{
  "$schema": "../schemas/openapi-operations.schema.json",
  "sourceId": "kalshi-openapi-rest",
  "url": "https://docs.kalshi.com/openapi.yaml",
  "version": "3.34.0",
  "sha256": "091f171718a0376b0c1a2e9348b02b1ce003d0786dd04d772dd11005ca414bf4",
  "operationCount": 118,
  "operations": [
    {
      "path": "/account/api_usage_level/upgrade",
      "method": "POST",
      "operationId": "UpgradeAccountApiUsageLevel",
      "summary": "Upgrade Account API Usage Level",
      "tags": [
        "account"
      ]
    },
    {
      "path": "/account/api_usage_level/volume_progress",
      "method": "GET",
      "operationId": "GetAccountApiUsageLevelVolumeProgress",
      "summary": "Get Account API Usage Level Volume Progress",
      "tags": [
        "account"
      ]
    },
    {
      "path": "/account/endpoint_costs",
      "method": "GET",
      "operationId": "GetAccountEndpointCosts",
      "summary": "List Non-Default Endpoint Costs",
      "tags": [
        "account"
      ]
    },
    {
      "path": "/account/limits",
      "method": "GET",
      "operationId": "GetAccountApiLimits",
      "summary": "Get Account API Limits",
      "tags": [
        "account"
      ]
    },
    {
      "path": "/api_keys",
      "method": "GET",
      "operationId": "GetApiKeys",
      "summary": "Get API Keys",
      "tags": [
        "api-keys"
      ]
    },
    {
      "path": "/api_keys",
      "method": "POST",
      "operationId": "CreateApiKey",
      "summary": "Create API Key",
      "tags": [
        "api-keys"
      ]
    },
    {
      "path": "/api_keys/{api_key}",
      "method": "DELETE",
      "operationId": "DeleteApiKey",
      "summary": "Delete API Key",
      "tags": [
        "api-keys"
      ]
    },
    {
      "path": "/api_keys/generate",
      "method": "POST",
      "operationId": "GenerateApiKey",
      "summary": "Generate API Key",
      "tags": [
        "api-keys"
      ]
    },
    {
      "path": "/communications/block-trade-proposals",
      "method": "GET",
      "operationId": "GetBlockTradeProposals",
      "summary": "Get Block Trade Proposals",
      "tags": [
        "communications"
      ]
    },
    {
      "path": "/communications/block-trade-proposals",
      "method": "POST",
      "operationId": "ProposeBlockTrade",
      "summary": "Propose Block Trade",
      "tags": [
        "communications"
      ]
    },
    {
      "path": "/communications/block-trade-proposals/{block_trade_proposal_id}/accept",
      "method": "POST",
      "operationId": "AcceptBlockTradeProposal",
      "summary": "Accept Block Trade Proposal",
      "tags": [
        "communications"
      ]
    },
    {
      "path": "/communications/id",
      "method": "GET",
      "operationId": "GetCommunicationsID",
      "summary": "Get Communications ID",
      "tags": [
        "communications"
      ]
    },
    {
      "path": "/communications/quotes",
      "method": "GET",
      "operationId": "GetQuotes",
      "summary": "Get Quotes",
      "tags": [
        "communications"
      ]
    },
    {
      "path": "/communications/quotes",
      "method": "POST",
      "operationId": "CreateQuote",
      "summary": "Create Quote",
      "tags": [
        "communications"
      ]
    },
    {
      "path": "/communications/quotes/{quote_id}",
      "method": "DELETE",
      "operationId": "DeleteQuote",
      "summary": "Delete Quote",
      "tags": [
        "communications"
      ]
    },
    {
      "path": "/communications/quotes/{quote_id}",
      "method": "GET",
      "operationId": "GetQuote",
      "summary": "Get Quote",
      "tags": [
        "communications"
      ]
    },
    {
      "path": "/communications/quotes/{quote_id}/accept",
      "method": "PUT",
      "operationId": "AcceptQuote",
      "summary": "Accept Quote",
      "tags": [
        "communications"
      ]
    },
    {
      "path": "/communications/quotes/{quote_id}/confirm",
      "method": "PUT",
      "operationId": "ConfirmQuote",
      "summary": "Confirm Quote",
      "tags": [
        "communications"
      ]
    },
    {
      "path": "/communications/rfqs",
      "method": "GET",
      "operationId": "GetRFQs",
      "summary": "Get RFQs",
      "tags": [
        "communications"
      ]
    },
    {
      "path": "/communications/rfqs",
      "method": "POST",
      "operationId": "CreateRFQ",
      "summary": "Create RFQ",
      "tags": [
        "communications"
      ]
    },
    {
      "path": "/communications/rfqs/{rfq_id}",
      "method": "DELETE",
      "operationId": "DeleteRFQ",
      "summary": "Delete RFQ",
      "tags": [
        "communications"
      ]
    },
    {
      "path": "/communications/rfqs/{rfq_id}",
      "method": "GET",
      "operationId": "GetRFQ",
      "summary": "Get RFQ",
      "tags": [
        "communications"
      ]
    },
    {
      "path": "/communications/rfqs/{rfq_id}/quotes/{quote_id}",
      "method": "DELETE",
      "operationId": "DeleteRFQQuote",
      "summary": "Delete RFQ Quote",
      "tags": [
        "communications"
      ]
    },
    {
      "path": "/communications/rfqs/{rfq_id}/quotes/{quote_id}",
      "method": "GET",
      "operationId": "GetRFQQuote",
      "summary": "Get RFQ Quote",
      "tags": [
        "communications"
      ]
    },
    {
      "path": "/communications/rfqs/{rfq_id}/quotes/{quote_id}/accept",
      "method": "PUT",
      "operationId": "AcceptRFQQuote",
      "summary": "Accept RFQ Quote",
      "tags": [
        "communications"
      ]
    },
    {
      "path": "/communications/rfqs/{rfq_id}/quotes/{quote_id}/confirm",
      "method": "PUT",
      "operationId": "ConfirmRFQQuote",
      "summary": "Confirm RFQ Quote",
      "tags": [
        "communications"
      ]
    },
    {
      "path": "/events",
      "method": "GET",
      "operationId": "GetEvents",
      "summary": "Get Events",
      "tags": [
        "events"
      ]
    },
    {
      "path": "/events/{event_ticker}",
      "method": "GET",
      "operationId": "GetEvent",
      "summary": "Get Event",
      "tags": [
        "events"
      ]
    },
    {
      "path": "/events/{event_ticker}/metadata",
      "method": "GET",
      "operationId": "GetEventMetadata",
      "summary": "Get Event Metadata",
      "tags": [
        "events"
      ]
    },
    {
      "path": "/events/fee_changes",
      "method": "GET",
      "operationId": "GetEventFeeChanges",
      "summary": "Get Event Fee Changes",
      "tags": [
        "events"
      ]
    },
    {
      "path": "/events/multivariate",
      "method": "GET",
      "operationId": "GetMultivariateEvents",
      "summary": "Get Multivariate Events",
      "tags": [
        "events"
      ]
    },
    {
      "path": "/exchange/schedule",
      "method": "GET",
      "operationId": "GetExchangeSchedule",
      "summary": "Get Exchange Schedule",
      "tags": [
        "exchange"
      ]
    },
    {
      "path": "/exchange/status",
      "method": "GET",
      "operationId": "GetExchangeStatus",
      "summary": "Get Exchange Status",
      "tags": [
        "exchange"
      ]
    },
    {
      "path": "/exchange/user_data_timestamp",
      "method": "GET",
      "operationId": "GetUserDataTimestamp",
      "summary": "Get User Data Timestamp",
      "tags": [
        "exchange"
      ]
    },
    {
      "path": "/fcm/fills",
      "method": "GET",
      "operationId": "GetFCMFills",
      "summary": "Get FCM Fills",
      "tags": [
        "fcm"
      ]
    },
    {
      "path": "/fcm/orders",
      "method": "GET",
      "operationId": "GetFCMOrders",
      "summary": "Get FCM Orders",
      "tags": [
        "fcm"
      ]
    },
    {
      "path": "/fcm/positions",
      "method": "GET",
      "operationId": "GetFCMPositions",
      "summary": "Get FCM Positions",
      "tags": [
        "fcm"
      ]
    },
    {
      "path": "/fcm/positions/transfers",
      "method": "POST",
      "operationId": "CreateFCMPositionTransfer",
      "summary": "Create FCM Position Transfer",
      "tags": [
        "fcm"
      ]
    },
    {
      "path": "/fcm/subtraders",
      "method": "GET",
      "operationId": "ListFCMSubtraders",
      "summary": "List FCM Subtraders",
      "tags": [
        "fcm"
      ]
    },
    {
      "path": "/fcm/subtraders",
      "method": "POST",
      "operationId": "CreateFCMSubtrader",
      "summary": "Create FCM Subtrader",
      "tags": [
        "fcm"
      ]
    },
    {
      "path": "/fcm/subtraders/blocked_categories",
      "method": "GET",
      "operationId": "GetFCMSubtraderBlockedCategories",
      "summary": "Get FCM Subtrader Blocked Categories",
      "tags": [
        "fcm"
      ]
    },
    {
      "path": "/fcm/subtraders/blocked_categories",
      "method": "PUT",
      "operationId": "UpdateFCMSubtraderBlockedCategories",
      "summary": "Update FCM Subtrader Blocked Categories",
      "tags": [
        "fcm"
      ]
    },
    {
      "path": "/fcm/subtraders/event_contract_daily_cap",
      "method": "DELETE",
      "operationId": "DeleteFCMEventContractDailyCap",
      "summary": "Delete FCM Subtrader Event Contract Daily Cap",
      "tags": [
        "fcm"
      ]
    },
    {
      "path": "/fcm/subtraders/event_contract_daily_cap",
      "method": "GET",
      "operationId": "GetFCMEventContractDailyCap",
      "summary": "Get FCM Subtrader Event Contract Daily Cap",
      "tags": [
        "fcm"
      ]
    },
    {
      "path": "/fcm/subtraders/event_contract_daily_cap",
      "method": "PUT",
      "operationId": "UpdateFCMEventContractDailyCap",
      "summary": "Update FCM Subtrader Event Contract Daily Cap",
      "tags": [
        "fcm"
      ]
    },
    {
      "path": "/historical/cutoff",
      "method": "GET",
      "operationId": "GetHistoricalCutoff",
      "summary": "Get Historical Cutoff Timestamps",
      "tags": [
        "historical"
      ]
    },
    {
      "path": "/historical/fills",
      "method": "GET",